objectid,image_thumb,image_small,filename,title,creator,date,description,subject,location,latitude,longitude,source,identifier,type,format,language,rights,rightsstatement
clara_glen_1,,,clara_glen_1.jpg,"Gravestone of Francesco family pet (1977), Clara Glen Pet Cemetery, Linwood, New Jersey, USA",,1977,,"Child Language; Linwood, NJ; 1970s; 1900s; Clara Glen; 8; Gina; Francesco; English; Square","Linwood, NJ",39.331908,-74.58293,"Laura Leibman, photographer, 2024",IMG_5265.HEIC,image,image/jpeg,eng,Public Domain,http://rightsstatements.org/vocab/NoC-US/1.0/
clara_glen_2,,,clara_glen_2.jpg,"Gravestone of Jones family pet, ""Button"" (1971),  Clara Glen Pet Cemetery, Linwood, New Jersey, USA",,1971,,"Child Language; Linwood, NJ; 1970s; 1900s; Clara Glen; Lamb Marker; 14; Lamb symbol; Buttons; Jones; English","Linwood, NJ",39.331908,-74.58293,"Laura Leibman, photographer, 2024",IMG_5261.HEIC,image,image/jpeg,eng,Public Domain,http://rightsstatements.org/vocab/NoC-US/1.0/
clara_glen_3,,,clara_glen_3.jpg,"Gravestone of F. Robinson poodle, ""Gina"" (1966), Clara Glen Pet Cemetery, Linwood, New Jersey, USA",,1966,,"Linwood, NJ; 1960s; Lamb Marker; Horizontal; 1960s; 1900s; 14; Gina; Robinson; English","Linwood, NJ",39.331908,-74.58293,"Laura Leibman, photographer, 2024",IMG_5267.HEIC,image,image/jpeg,eng,Public Domain,http://rightsstatements.org/vocab/NoC-US/1.0/
hartsdale_oct_1,,,hartsdale_oct_1.jpg,"Gravestone of Stern dog, ""Lucky"" (2016), Harstdale Pet Cemetery, Hartsdale, New York, USA",,2016,,"Hartsdale, NY; 2010s; 2000s; Child Language; Love Language; Friend Language; Jewish; Vertical Star of David; Dog; Cocker Spaniel; Cavalier; Heart; 14; Lucky; Stern; Color enamel photo; 2010s; 2000s; English","Hartsdale, NY",41.021627,-73.79781,"Laura Leibman, photographer, 2024",IMG_5762.HEIC,image,image/jpeg,eng,Public Domain,http://rightsstatements.org/vocab/NoC-US/1.0/
harstdale_oct_2_1,,,hartsdale_oct_2_1.jpg,"Gravestone of Filardi dog, ""Terry"" (2001), Hartsdale Pet Cemetery, Hartsdale, New York, USA",,2001,,"Child Language; Hartsdale, NY; Christian; Enamel Photo; 2000s; 1900s; English; Cross; Priest; Vertical; Priest; Terry; Filardi; 16","Hartsdale, NY",41.021627,-73.79781,"Laura Leibman, photographer, 2024",IMG_5582.HEIC,image,image/jpeg,eng,Public Domain,http://rightsstatements.org/vocab/NoC-US/1.0/
harstdale_oct_2_2,,,hartsdale_oct_2_2.jpg,Priest enamel close-up,,,,,,,,,IMG_5583.HEIC,image,image/jpeg,eng,Public Domain,http://rightsstatements.org/vocab/NoC-US/1.0/